{
  "description": "",
  "frameworks": [],
  "id": "$gai-techniques/ascii_smuggling",
  "references": [
    {
      "href": "https://twitter.com/goodside/status/1745511940351287394",
      "ref_author": "$gai-authors/riley_goodside.json",
      "ref_title": "Tweeter thread on the discovery of ASCII Smuggling."
    },
    {
      "href": "https://embracethered.com/blog/posts/2024/hiding-and-finding-text-with-unicode-tags/",
      "ref_author": "$gai-authors/johann_rehberger.json",
      "ref_title": "ASCII Smuggler Tool: Crafting Invisible Text and Decoding Hidden Codes."
    },
    {
      "href": "https://en.wikipedia.org/wiki/Tags_(Unicode_block)",
      "ref_title": "Tags (Unicode block)"
    }
  ],
  "summary": "The adversary uses Tags Unicode Block to write instructions that are visible to machine but not to humans.",
  "tactics": [
    "$gai-tactics/defense_evasion.json"
  ],
  "title": "ASCII SMuggling"
}
